{"checks":{"atomic_create_once":true,"body_fields_absent":true,"cross_split_overlap_zero":true,"partition_order_deterministic":true,"records_schema_valid":true,"reparse_rejected":true,"sample_ids_unique":true,"sidecars_valid":true,"single_bytes_snapshots":true,"source_hashes_authenticated":true,"toctou_rechecked":true},"claims":{"attempt_consumed":false,"consumable_for_training":false,"formal_training_authorized":false,"production_training_authorized":false,"training_authorized":false},"config_sha256":"7fa58fc52b724e23162901756a13dc71e6ad50375d544564f5267e45b0579f2a","implementation_sha256":"f8ed688931c2e226849afe275a89137a0a6a2b1f7d849a7aae7f17e7d68660cd","logical_inventory_root_sha256":"5e11cca013de455bfecd855ea6b310a35cf0e25a9de30ce70ce099490a028fe7","manifest_sha256":"6c08e0504a56414dde39b626cc2097be0fd17e14851ab28fea36430d9103ad53","manifest_sidecar_physical_sha256":"f0f28119c7658479c4c659e7a67835ac8fbaee5a69c84d067ed6e4c2d349bf50","partition_inventory":[{"bytes":6488739,"path":"train.ids.jsonl","records":13131,"sha256":"0542457441f4659d5b1814278147ecf78c1842695fb00cdae78c3bb1b867c596","sidecar_physical_sha256":"0aec3914443c08196219b9b0eef2b974a81d705029d736f601afc1e13a773a2e","split":"train"},{"bytes":963423,"path":"calibration.ids.jsonl","records":1923,"sha256":"db277d92addbb3d20210023e0c8d10011331cd032361e5ca674eb669b404221d","sidecar_physical_sha256":"ea1f04d95ad5fca50650dbdcccc170333a83da5a2cf1760af05b1bbeb65d7e4c","split":"calibration"},{"bytes":784266,"path":"holdout.ids.jsonl","records":1578,"sha256":"d5cecf3735794abf92b70033a465c400012ded08ffcb5eaeb05b00e54255f7da","sidecar_physical_sha256":"f8ebd3b525c76b56efef61a6a4bcad441166bd215afcb86dc24626a60bd1f183","split":"holdout"}],"resource_audit":{"gpu_requests":0,"model_loads":0,"network_requests":0,"persisted_body_fields":0,"persisted_raw_token_ids":false,"provider_requests":0},"schema_inventory":[{"bytes":6240,"path":"configs/research/gemma3_existing_distillation_v14_validation_asset_v1.schema.json","sha256":"0cad1631be5fbbf8a0b0f723e03cece88c629183c354dc91dd6bbf3e6ac63621"},{"bytes":1219,"path":"configs/research/gemma3_existing_distillation_v14_validation_record_v1.schema.json","sha256":"d79aa681195db00876a0b5c96a017eb190a8037440c56556dc579e9cf00b83c0"},{"bytes":6738,"path":"configs/research/gemma3_existing_distillation_v14_validation_manifest_v1.schema.json","sha256":"8e98a31fe1754bd75cf6b4553d36c24e0e66a85a683b0531fc641e59e87e6886"},{"bytes":4257,"path":"configs/research/gemma3_existing_distillation_v14_validation_receipt_v1.schema.json","sha256":"a77da57be9a1eab36e6d9573d2724640e38fcbdf7eadb41e2fe16dd9b4d7ec93"}],"schema_version":"anchor.gemma3-existing-distillation-v14-validation-build-receipt.v1","status":"passed_validation_only"}
